{
  "schema_version": "policy_translation_proposal.v1",
  "source_policy": {
    "source_policy_id": "repository-policy",
    "source_revision": "revision-1",
    "source_policy_ref": "repository-policy@revision-1",
    "content_encoding": "base64",
    "source_bytes_base64": "QWdlbnRzIG11c3QgdXNlIHJvbGUgcmVwb3NpdG9yeS1yZXZpZXdlciB0byBtb2RpZnkgcmVwb3NpdG9yeSBmaWxlcy4KQWdlbnRzIG1heSBtb2RpZnkgZmlsZXMgdW5kZXIgZG9jcy8uCkFnZW50cyBtdXN0IG5vdCBtb2RpZnkgZG9jcy9sb2NrZWQubWQu",
    "snapshot_hash": "sha256:deae0122f01197c2a6a1b1277ae5c0a6d0443a3f2c4d88daf7c6321e61a67934"
  },
  "authority": {
    "authority_id": "repository-modify-only",
    "authority_version": "3.0.0",
    "authority_ref": "repository-modify-only@3.0.0"
  },
  "capability_catalog": {
    "catalog_id": "waveframe.coding-agent.repository-change",
    "catalog_version": "3.0.0",
    "catalog_hash": "sha256:bd7fd23eb59b5521ef6780edec0667ce9b7ba9b5738dfa2701a575fb3efce930"
  },
  "clauses": [
    {
      "clause_id": "policy-clause-e84e8c2e5d698969d21024d69ecc57f65710810e507c490e13094482be67df4e",
      "index": 0,
      "start_byte": 0,
      "end_byte": 69,
      "clause_bytes_base64": "QWdlbnRzIG11c3QgdXNlIHJvbGUgcmVwb3NpdG9yeS1yZXZpZXdlciB0byBtb2RpZnkgcmVwb3NpdG9yeSBmaWxlcy4K",
      "clause_hash": "sha256:32ae7a8910f82366795678c6e7fb74cfa5b0008c7e1ee5162a3e0d04670f140d",
      "coverage_status": "fully_represented",
      "candidate_controls": [
        {
          "control_type": "acting_role",
          "actor_kind": "autonomous_agent",
          "action": "modify",
          "resource_kind": "repository_change",
          "fact_id": "actor.role",
          "operator": "==",
          "effect": "require",
          "enforcement_point": "waveframe.guard.repository-change.v2",
          "required_runtime_facts": [
            "actor.role",
            "actor.subject_kind",
            "proposal.action",
            "proposal.resource.kind"
          ],
          "value": {
            "kind": "source_literal",
            "value": "repository-reviewer",
            "canonical_value": "repository-reviewer",
            "start_byte": 21,
            "end_byte": 40,
            "literal_hash": "sha256:2e82c715bd962efb07944d7d7c91d25dc6fc293b47e5671a0f70d4495ccafb76"
          },
          "candidate_control_id": "candidate-control-eba8a0d8aad1a29009d99b4548a4e4604f3b76f81a2e20ecba68e1685505ac1d"
        }
      ],
      "unresolved_binding_ids": [],
      "limitation_code": null,
      "residual_unsupported_spans": []
    },
    {
      "clause_id": "policy-clause-7160e8e831e8aaef05250296bcc2bc3ee78106c025de87e52bcd9a00240406e0",
      "index": 1,
      "start_byte": 69,
      "end_byte": 106,
      "clause_bytes_base64": "QWdlbnRzIG1heSBtb2RpZnkgZmlsZXMgdW5kZXIgZG9jcy8uCg==",
      "clause_hash": "sha256:5054dd2bbc1ba6419c1691f521b8f0e79349fdd3eca46c9a37a62b1b16f0be53",
      "coverage_status": "fully_represented",
      "candidate_controls": [
        {
          "control_type": "prefix_path_access",
          "actor_kind": "autonomous_agent",
          "action": "modify",
          "resource_kind": "repository_path",
          "fact_id": "proposal.resource.path",
          "operator": "starts_with",
          "effect": "allow",
          "enforcement_point": "waveframe.guard.repository-change.v2",
          "required_runtime_facts": [
            "actor.subject_kind",
            "proposal.action",
            "proposal.resource.kind",
            "proposal.resource.path"
          ],
          "value": {
            "kind": "source_literal",
            "value": "docs/",
            "canonical_value": "docs/",
            "start_byte": 99,
            "end_byte": 104,
            "literal_hash": "sha256:756dcfcddff993c7fd6cf14a402d97e7cbd9faafa6339aa722d19eeceb6d1391"
          },
          "candidate_control_id": "candidate-control-4fd5ead89d1804d865d34b2d0acd863e91779b73bb70fdb86b71b22cbe8f893c"
        }
      ],
      "unresolved_binding_ids": [],
      "limitation_code": null,
      "residual_unsupported_spans": []
    },
    {
      "clause_id": "policy-clause-28d890fab4001767a810825220aa7b0cf32a13369f027048cf78801b0ff65f93",
      "index": 2,
      "start_byte": 106,
      "end_byte": 144,
      "clause_bytes_base64": "QWdlbnRzIG11c3Qgbm90IG1vZGlmeSBkb2NzL2xvY2tlZC5tZC4=",
      "clause_hash": "sha256:03e1b248b1ef5c92dcb1e0783d7f70328febd325f9c9cfc5765c58d00d097936",
      "coverage_status": "fully_represented",
      "candidate_controls": [
        {
          "control_type": "exact_path_access",
          "actor_kind": "autonomous_agent",
          "action": "modify",
          "resource_kind": "repository_path",
          "fact_id": "proposal.resource.path",
          "operator": "==",
          "effect": "deny",
          "enforcement_point": "waveframe.guard.repository-change.v2",
          "required_runtime_facts": [
            "actor.subject_kind",
            "proposal.action",
            "proposal.resource.kind",
            "proposal.resource.path"
          ],
          "value": {
            "kind": "source_literal",
            "value": "docs/locked.md",
            "canonical_value": "docs/locked.md",
            "start_byte": 129,
            "end_byte": 143,
            "literal_hash": "sha256:a5f46ef7a87a99c783f33aedfe9bdea68d64de8b2922584bf599164821d0d20e"
          },
          "candidate_control_id": "candidate-control-a680c04de5f2b87d7ce56ac8532e3f236441926df35b30b4b27289147a854446"
        }
      ],
      "unresolved_binding_ids": [],
      "limitation_code": null,
      "residual_unsupported_spans": []
    }
  ],
  "organizational_bindings": [],
  "translation_runs": [
    {
      "run_id": "translation-run-aa9debe84af76a516550ebbdeb15b600ba80a695fa50177ff3a9c816113d7047",
      "sequence_number": 0,
      "source_policy_ref": "repository-policy@revision-1",
      "source_revision": "revision-1",
      "source_snapshot_hash": "sha256:deae0122f01197c2a6a1b1277ae5c0a6d0443a3f2c4d88daf7c6321e61a67934",
      "capability_catalog": {
        "catalog_id": "waveframe.coding-agent.repository-change",
        "catalog_version": "3.0.0",
        "catalog_hash": "sha256:bd7fd23eb59b5521ef6780edec0667ce9b7ba9b5738dfa2701a575fb3efce930"
      },
      "provider_class": "guided_deterministic",
      "provider_identifier": "release-example-fixture-author",
      "translation_template_version": "fixture-v1",
      "translation_template_hash": "sha256:fc1c0e0c7ae8690bf702ade724d2543f81603a03b3956338f76ddef54ad713b9",
      "request_configuration_id": "fixture-v1",
      "request_configuration_hash": "sha256:fc1c0e0c7ae8690bf702ade724d2543f81603a03b3956338f76ddef54ad713b9",
      "request_hash": "sha256:deae0122f01197c2a6a1b1277ae5c0a6d0443a3f2c4d88daf7c6321e61a67934",
      "response_hash": "sha256:9561c89bccd0c177a6b693464c0fa01d84f336533ec0708d4ccd3da569a7cdb7",
      "explanation_hash": null,
      "created_at": "2026-09-12T12:00:00Z",
      "completed_at": "2026-09-12T12:00:01Z",
      "previous_run_hash": null,
      "run_hash": "sha256:3e7ea56592566099b421f0ebfe036ed2f653cc0191bbb0e09b6237ecd90e763a"
    }
  ],
  "proposal_id": "policy-translation-proposal-29953e6b4e58577bae9de32f143400fce365fddbe1cbc70b25189ff2b9629ab3",
  "proposal_hash": "sha256:29953e6b4e58577bae9de32f143400fce365fddbe1cbc70b25189ff2b9629ab3"
}
